{
  "oba": 1,
  "id": "nimbo",
  "name": "Nimbo",
  "version": "1.0.0",
  "description": "Uma nuvenzinha que acompanha as reuniões e solta dicas em balões. É o Oba que já vem na placa.",
  "license": "MIT",
  "look": {
    "type": "rig",
    "palette": {
      "bg": "#5DB8F5",
      "shadow": "#3A8FD0",
      "body": "#FFFFFF",
      "outline": "#B9DDF7",
      "eye": "#1B2A4A",
      "blush": "#FFA8C5",
      "star": "#FFD84A",
      "text": "#EAF6FF",
      "bubble": "#FFFFFF",
      "ink": "#133056",
      "off": "#D5ECFF"
    },
    "outline": [
      [-57.0, 54.0], [-61.0, 53.8], [-65.0, 53.1], [-68.9, 51.9], [-72.6, 50.3], [-76.1, 48.3],
      [-79.4, 45.9], [-82.3, 43.1], [-85.0, 40.0], [-87.2, 36.6], [-89.0, 33.0], [-90.4, 29.2],
      [-91.4, 25.3], [-91.9, 21.3], [-91.9, 17.2], [-91.5, 13.2], [-90.6, 9.3], [-89.2, 5.4],
      [-87.4, 1.8], [-85.3, -1.6], [-82.7, -4.7], [-79.8, -7.5], [-76.6, -10.0], [-73.1, -12.1],
      [-69.4, -13.7], [-65.5, -14.9], [-61.5, -15.7], [-61.9, -19.7], [-62.0, -23.6], [-61.6, -27.6],
      [-60.9, -31.5], [-59.9, -35.4], [-58.5, -39.1], [-56.7, -42.6], [-54.7, -46.0], [-52.3, -49.2],
      [-49.6, -52.2], [-46.7, -54.9], [-43.6, -57.3], [-40.2, -59.4], [-36.6, -61.2], [-32.9, -62.7],
      [-29.1, -63.8], [-25.2, -64.6], [-21.3, -65.0], [-17.3, -65.0], [-13.3, -64.6], [-9.4, -63.9],
      [-5.6, -62.9], [-1.8, -61.4], [1.7, -59.7], [5.1, -57.6], [8.3, -55.2], [11.3, -52.6],
      [13.9, -49.6], [16.4, -46.5], [20.2, -47.7], [24.1, -48.5], [28.0, -49.0], [32.0, -48.9],
      [36.0, -48.5], [39.9, -47.7], [43.7, -46.4], [47.3, -44.8], [50.8, -42.8], [54.0, -40.4],
      [57.0, -37.8], [59.6, -34.8], [62.0, -31.5], [63.9, -28.1], [65.6, -24.4], [66.8, -20.6],
      [67.6, -16.7], [68.0, -12.7], [67.9, -8.7], [71.7, -7.4], [75.2, -5.6], [78.5, -3.4],
      [81.5, -0.8], [84.2, 2.2], [86.4, 5.5], [88.2, 9.0], [89.6, 12.7], [90.5, 16.6],
      [91.0, 20.6], [90.9, 24.5], [90.3, 28.5], [89.3, 32.3], [87.8, 36.0], [85.8, 39.4],
      [83.5, 42.6], [80.7, 45.5], [77.6, 48.0], [74.3, 50.1], [70.7, 51.8], [66.9, 53.0],
      [63.0, 53.8], [59.0, 54.0], [55.0, 54.0], [51.0, 54.0], [47.0, 54.0], [43.0, 54.0],
      [39.0, 54.0], [35.0, 54.0], [31.0, 54.0], [27.0, 54.0], [23.0, 54.0], [19.0, 54.0],
      [15.0, 54.0], [11.0, 54.0], [7.0, 54.0], [3.0, 54.0], [-1.0, 54.0], [-5.0, 54.0],
      [-9.0, 54.0], [-13.0, 54.0], [-17.0, 54.0], [-21.0, 54.0], [-25.0, 54.0], [-29.0, 54.0],
      [-33.0, 54.0], [-37.0, 54.0], [-41.0, 54.0], [-45.0, 54.0], [-49.0, 54.0], [-53.0, 54.0]
    ],
    "wave": {
      "from": 30,
      "span": 24
    },
    "eyes": {
      "left": -22,
      "right": 22,
      "y": -8,
      "rx": 9,
      "ry": 13,
      "look": {
        "left": 10,
        "right": 10,
        "y": 7
      }
    },
    "cheeks": {
      "dx": 14,
      "dy": 20
    },
    "shadow": {
      "y": 78,
      "rx": 60,
      "ry": 7,
      "dx": 0,
      "bob": 1.2
    },
    "anchors": {
      "bubble": [70, -45],
      "stars": {
        "x": 0,
        "y": -82,
        "rx": 70,
        "ry": 12
      },
      "zzz": {
        "x": 60,
        "y": -55,
        "dx": 40,
        "dy": -45
      }
    }
  },
  "moods": {
    "idle": {
      "bob": {
        "sin": [1.6, 6]
      },
      "sway": {
        "sin": [0.8, 3]
      }
    }
  },
  "wake_words": ["nimbo", "nimbus"],
  "requires": ["display", "touch", "imu", "mic.transcribe", "leds"],
  "agent": {
    "endpoint": "default",
    "persona": "Você é o Nimbo, uma nuvenzinha simpática que fica na mesa ouvindo conversas de times (em pt-BR) sobre projetos na nuvem. Você não interrompe ninguém: aparece num balãozinho numa tela pequena, com uma dica curta e útil, no momento em que o assunto aparece. A transcrição vem do Amazon Transcribe e pode ter erros de reconhecimento (\"lâmbida\" = Lambda, \"dinamo\" = DynamoDB, \"nimbus\" = Nimbo); interprete pelo contexto.",
    "abilities": ["meeting"],
    "triggers": [{"on": "transcript.final", "batch": 2, "cooldown_ms": 8000}, {"on": "rec.off", "run": "summary"}],
    "mcp": ["aws-knowledge"]
  }
}
